{
  "claim_id": "pf.integral.000002",
  "claim_type": "symbolic_antiderivative",
  "title": "Derivative certificate for log(x)/2 − log(x+1) + log(x+2)/2",
  "natural_language": "The derivative of log(x)/2 − log(x+1) + log(x+2)/2 is 1/(x(x+1)(x+2)). Domain: x ≠ 0, x ≠ −1, x ≠ −2. FriCAS omits all three nonzero conditions.",
  "source": {
    "kind": "cas",
    "name": "FriCAS",
    "version": "1.3.11"
  },
  "inputs": {
    "integrand": "1/(x*(x+1)*(x+2))",
    "variable": "x"
  },
  "outputs": {
    "candidate_antiderivative": "log(x)/2 - log(x+1) + log(x+2)/2"
  },
  "formal_targets": [
    {
      "system": "Lean4",
      "statement_text": "∀ (x : ℝ), x ≠ 0 → x + 1 ≠ 0 → x + 2 ≠ 0 → HasDerivAt (fun t => Real.log t / 2 - Real.log (t+1) + Real.log (t+2) / 2) (1 / (x * (x+1) * (x+2))) x",
      "status": "proved"
    }
  ],
  "assumptions": [
    {"kind": "domain", "statement": "x ≠ 0",     "required_by": "Real.log", "discharged": false},
    {"kind": "domain", "statement": "x + 1 ≠ 0", "required_by": "Real.log", "discharged": false},
    {"kind": "domain", "statement": "x + 2 ≠ 0", "required_by": "Real.log", "discharged": false}
  ],
  "obligations": [
    {
      "obligation_id": "pf.integral.000002.derivative",
      "kind": "formal_derivative_check",
      "checker": "Lean4",
      "status": "passed",
      "artifact": "fricas_bridge/RischVerification.lean"
    }
  ],
  "checker_results": [
    {
      "checker": "Lean4",
      "checker_version": "4.x",
      "result": "passed",
      "formal_verified": true,
      "artifact": "fricas_bridge/RischVerification.lean"
    }
  ],
  "evidence_class": "E7_FORMALLY_VERIFIED",
  "flags": ["REQUIRES_ASSUMPTIONS"],
  "artifacts": {
    "lean_file": "fricas_bridge/RischVerification.lean"
  },
  "metadata": {
    "tags": ["integration", "Class-D", "three-poles", "partial-fractions", "bronstein"],
    "notes": "risch_three_poles theorem in RischVerification.lean"
  }
}
