{
  "claim_id": "pf.numexp.000001",
  "claim_type": "numerical_experiment",
  "title": "Euler's constant γ ≈ 0.5772156649 to 10 decimal places",
  "natural_language": "The Euler–Mascheroni constant γ = lim_{n→∞} (Σ_{k=1}^{n} 1/k − ln n) ≈ 0.5772156649015328606.",
  "source": {
    "kind": "paper",
    "name": "OEIS A001620"
  },
  "inputs": {
    "sequence": "partial sums of harmonic series minus log(n)",
    "precision": "50 decimal places"
  },
  "outputs": {
    "value": "0.57721566490153286060651209008240243104215933593992"
  },
  "formal_targets": [],
  "assumptions": [],
  "obligations": [
    {
      "obligation_id": "pf.numexp.000001.numeric",
      "kind": "numeric_property",
      "checker": "hypothesis",
      "status": "pending"
    }
  ],
  "checker_results": [],
  "evidence_class": "E2_PARSED",
  "flags": [],
  "artifacts": {},
  "metadata": {
    "tags": ["constants", "euler-mascheroni", "harmonic-series"]
  }
}
